{
  "schema": "cassandra-index-countries",
  "schema_version": 1,
  "site": "https://cassindex.ru",
  "license": {
    "name": "CC BY 4.0",
    "url": "https://creativecommons.org/licenses/by/4.0/legalcode",
    "attribution": "Cassandra Index — https://cassindex.ru, лицензия CC BY 4.0",
    "note": "Атрибуция обязательна: при переиспользовании укажите «Cassandra Index, версия, дата недели, https://cassindex.ru» и лицензию CC BY 4.0.",
    "placeholder": false
  },
  "week": "2026-10-25",
  "methodology": "3.0",
  "countries": {
    "total": 152,
    "published": 2,
    "rows": {
      "RU": {
        "index": 66,
        "delta": -2,
        "background": false,
        "region": "russia-belarus",
        "signals": 8
      },
      "UA": {
        "index": 68,
        "delta": 5,
        "background": false,
        "region": "ukraine-moldova",
        "signals": 7
      }
    }
  },
  "sensitivity": 1.1,
  "note": "Страновой слой наследует sensitivity недели: чувствительность страновых индексов к исключению доменов/кластеров источников раскрывается числом недели, отдельной метрики по странам не считается."
}
